[
  {
    "attempts": [
      {
        "attempt": 1,
        "resolved": true,
        "wait_until": "networkidle"
      }
    ],
    "error": "",
    "final_url": "https://example.org/",
    "pdf": "artifacts/pdf/001.pdf",
    "screenshot": "artifacts/screenshots/001.png",
    "status": "200",
    "url": "https://example.org/"
  }
]

